{
  "dataset_hashes": {
    "device.audio/en": "aaaaaaaaaaaaaaaaaaaaaaaaaaaaaaaaaaaaaaaaaaaaaaaaaaaaaaaaaaaaaaaa",
    "device.audio/fr": "bbbbbbbbbbbbbbbbbbbbbbbbbbbbbbbbbbbbbbbbbbbbbbbbbbbbbbbbbbbbbbbb",
    "assistant.reminder/en": "cccccccccccccccccccccccccccccccccccccccccccccccccccccccccccccccc",
    "assistant.reminder/fr": "dddddddddddddddddddddddddddddddddddddddddddddddddddddddddddddddd"
  },
  "env_lock_hash": "ffffffffffffffffffffffffffffffffffffffffffffffffffffffffffffffff",
  "compiler_version": "nlu-compiler 0.0.0-golden",
  "git_commit": "0000000",
  "training_run_ids": [
    "golden-run-0002"
  ],
  "experiment_ids": [
    "exp-golden-01"
  ]
}
