{
  "dataset_hashes": {
    "device.audio/en": "aaaaaaaaaaaaaaaaaaaaaaaaaaaaaaaaaaaaaaaaaaaaaaaaaaaaaaaaaaaaaaaa"
  },
  "env_lock_hash": "cccccccccccccccccccccccccccccccccccccccccccccccccccccccccccccccc",
  "compiler_version": "nlu-compiler 0.0.0-golden",
  "git_commit": "0000000",
  "training_run_ids": ["golden-run-0001"]
}
